translated_title,score,text,source
"Sinner-Rune, the Atp Finals match in Turin. Jannik wins and finishes first in the round. Chronicle 6-2, 5-7, 6-4",4,"Ore 00:05 - Il terzo capolavoro di Sinner(Gaia Piccardi, inviata a Torino) Macché biscotto, è uno spezzatino. Holger Rune esce a pezzi dall’incrocio con Jannik Sinner nell’ultima partita del girone, benché la qualificazione fosse già acquisita (una formula contro natura aveva assegnato un’importanza capitale al set vinto dalla riserva Hurkacz con Djokovic) mai al barone rosso è venuto in mente di lasciar vincere il danese per far fuori dal torneo il n. 1 del mondo. In palio dollari (400 mila), punti (200) e, soprattutto, onore: regalare a Rune un vantaggio di 3-0 (ora 2-1, era l’ultimo tabù tra gli attuali top 10) nei confronti diretti, che assurdità.E così Sinner, diventato negli ultimi cinque giorni torinesi il tennista in grado di cambiare palinsesti televisivi, scomodare stelle nostrane dello sport (Fabio Capello, visibilmente emozionato: «Non riesco a vederti, mi agito troppo»; Jannik: «Sei come mia madre»), far palpitare l’Italia, in un giovedì notte che profuma di storia diventa anche il primo azzurro capace di arrivare in semifinale alle Atp Finals in 53 anni del torneo dei maestri. Passa il taglio non senza patemi proprio insieme a Djokovic, il bagaglio pesante che decide di portare con sé in questo viaggio così intenso da avergli risvegliato il mal di schiena: la durezza del match di tre ore con il Djoker chiede il conto a Sinner con Rune. Quando Jannik fa una smorfia, il vantaggio è già consistente: due break (il primo è istantaneo) gli hanno consegnato il primo set 6-2, dopo pochi minuti di sfida impari Rune già mandava a quel paese il suo angolo (un luogo freddo del Grande Nord dove si stagliano come stalagmiti mamma Aneke e il totem Boris Becker), il top di dritto bene addomesticato dalla mano di Sinner, gli errori del rivale dettati dall’impazienza.Nel secondo set, però, la faccenda si complica. C’è una palla break annullata da Sinner con il servizio al quarto game, presagio dei guai che si materializzano sul 4-4: un erroraccio dell’azzurro accende il disagio fisico, il cambio di campo è speso in esercizi di mobilità, il game del 5-6 è un disastro. Sotto 0-40, con tre set point contro, Jannik ha la forza di annullarne due, però sul terzo cede: 7-5 Rune. Comincia un altro match perché ora il n. 4 è più falloso e il danese, come a Montecarlo, acquista forza, nutrendosi del tifo contro. Il rodeo del terzo è alimentato dal nervosismo del danese, che ha bisogno del rumore dei nemici per dare il meglio di sé mentre Sinner sembra gestire il dolore («Ho male» dice rivolto al box in trepidazione) però ha perso per strada l’efficienza: butta tre palle break nel terzo game (polemicona di Rune con la giudice di sedia, costretta a chiamare la Var), ne spreca una quarta nel quinto e ne cancella una mortifera al rivale nell’ottavo (regalo di Natale di Holger, che lo grazia con una risposta larga su una seconda palla non irresistibile).",https://www.corriere.it/sport/tennis/diretta-live/23_novembre_16/sinner-rune-diretta-atp-finals-torino-a4673292-84a6-11ee-87a1-ab403d0b1b3f.shtml
"Giulia Cecchettin and Filippo Turetta missing, his black Punto caught on camera in Zero Branco",1,"Treviso, l'immagine risale alla notte tra sabato e domenica. I due ex fidanzati mancano all'appello da quella sera: le ricerche in Veneto e l'itinerario della vettura registrata dal «targa system» C’è una prima «foto» dell’auto in fuga. Il fotogramma che raffigura la Grande Punto nera mentre passa nella notte tra sabato e domenica per Zero Branco, in provincia di Treviso, alle 00.43, dove è stata fotografata dal sistema di controllo delle targhe poco dopo essersi allontanata dal parcheggio in cui Giulia Cecchettin e Filippo Turetta avrebbero discusso attirando l’attenzione di un passante, intorno alle 23.15 di sabato sera. Dopo una settimana di ricerche è questa la prima immagine ufficiale dell’auto che tuttavia non è in grado di dare indicazioni sulla presenza di una o due persone a bordo. Si vedono solo i due fanali sfrecciare e nient’altro. La ricostruzione dell'itinerarioIntanto giovedì grazie all'odierna riattivazione di alcuni dispositivi elettronici di Piancavallo (Pordenone) che erano in manutenzione - ma che avevano in memoria i dati dei veicoli in transito - è stato ricostruito l'intero itinerario percorso, nella notte tra sabato e domenica, dalla Fiat Punto nera su cui si trovavano i due ragazzi veneti scomparsi. L'ingresso in territorio friulano è avvenuto dalla zona di confine con il Veneto, a Caneva. Pochi minuti dopo, il passaggio dell'utilitaria è stato registrato dai dispositivi di lettura targhe di Polcenigo. Il veicolo - si è appreso oggi - ha proseguito fino ad Aviano, per risalire agli oltre mille metri della stazione turistica del Piancavallo. Da lì, seguendo una strada secondaria - e poco conosciuta, la direttrice tramite Montereale Valcellina, la più consigliata dai navigatori satellitari - l'auto è scesa a Barcis, percorrendo l'arteria lungo lago e poi transitando lungo l'intera Valcellina, passando per Claut e Cimolais.",https://corrieredelveneto.corriere.it/notizie/treviso/cronaca/23_novembre_16/giulia-e-filippo-scomparsi-la-punto-nera-di-lui-ripresa-dalle-telecamere-a-zero-branco-75e7f7c9-56dd-4d15-8729-ad5b23149xlk.shtml
"Israel - Hamas at war, today's news | Idf: ""Hit tunnels where Hamas commanders are hiding."" Body of hostage found near Al Shifa",1,"È il 41esimo giorno di guerra: il bilancio tra i palestinesi è di 11.470 morti, di cui 4630 bambini. In Israele si contano 1.200 morti nell’attacco del 7 ottobre. Il raid dell’esercito israeliano all’ospedale di Al Shifa, a Gaza. Il piano degli Stati Uniti per Gaza, punto per punto. Le parole e le sigle per capire il conflitto: qui il glossario. La storia del conflitto tra palestinesi e israeliani, spiegata qui. Ore 02:55 - Blinken alla Giordania: preoccupato per i vostri medici a Gaza Il segretario di Stato americano Antony Blinken ha detto al ministro degli Esteri giordano Ayman Safadi che gli Stati Uniti condividono «la sua profonda preoccupazione per il personale medico giordano ferito fuori dall’ospedale da campo giordano mentre forniva cure mediche critiche a Gaza». Lo riportano i media Usa. Secondo un portavoce del Dipartimento di Stato americano, Blinken ha anche «ribadito che i civili e il personale medico negli ospedali devono essere protetti» e «ha espresso la gratitudine degli Stati Uniti a sua maestà il re Abdullah II, al governo e al popolo giordano per il continuo impegno fornitura di assistenza umanitaria essenziale al popolo palestinese». Blinken ha anche sottolineato l’impegno americano a «raggiungere una pace duratura attraverso la creazione di uno Stato palestinese come parte di una soluzione a due stati».Ore 02:50 - Netanyahu ammette: non riusciamo a ridurre il numero di civili mortiIl premier israeliano Benjamin Netanyahu ha accusato Hamas per gli sforzi «infruttuosi» volti a ridurre al minimo le morti civili a Gaza. In una intervista alla Cbs, Netanyahu ha affermato che Israele sta facendo tutto il possibile per tenere i civili lontani dal pericolo mentre combatte Hamas nella Striscia, anche «lanciando volantini» che li avvertono di fuggire, ma che i suoi tentativi di ridurre al minimo le vittime «non hanno avuto successo».Ore 02:31 - Netanyahu: nell’ospedale Al Shifa centro di comando di Hamas, ma i terroristi sono scappatiNell’ospedale al Shifa a Gaza c’era «un centro di comando e controllo” di Hamas. L’ha affermato il primo ministro israeliano Benjamin Netanyahu, difendendo l’azione contro il nosocomio in un’intervista alla CBS. «Avevamo prove concrete che c’erano capi terroristi e terroristi nell’ospedale. E sono scappati mentre le nostre forze si avvicinavano», ha detto Netanyahu. «Hamas ha usato i pazienti di quell’ospedale come scudi umani e al livello -2 abbiamo trovato un centro di comando e controllo e equipaggiamenti per la codifica militare. Abbiamo trovato bombe, abbiamo trovato armi, abbiamo trovato anche tunnel nel compound dell’ospedale», ha detto ancora il capo del governo israeliano. «Noi abbiamo fatto la cosa giusta: privare Hamas di questa zona sicura nell’ospedale e nello stesso tempo neutralizzare questo centro di comando terrorista». Netanyahu ha anche detto che una delle motivazioni che hanno portato all’azione era il fatto che avevano indizi concreti che lì fossero detenuti gli ostaggi israeliani catturati da Hamas. «Avevamo forti indicazioni che erano detenuti all’ospedale Al-Shifa, questo è uno dei motivi per cui sono entrati in ospedale», ha detto il primo ministro.",https://www.corriere.it/esteri/diretta-live/23_novembre_16/israele-hamas-guerra-notizie-oggi-679b864c-8406-11ee-bc7b-5eeb909484a1.shtml
The maneuver of broken promises: the numbers that defeat the government's proclamations,2,"“Curioso scioperare contro questa manovra, che mette 16 miliardi per pensionati, lavoratori e malati”, ha detto il vicepremier e leader della Lega Matteo Salvini. Ma l’analisi della seconda legge di Bilancio del governo Meloni racconta una storia diversa. La maggior parte delle risorse, frutto di un extra deficit da 15 miliardi, sono dedicate a rinnovare solo per un anno una misura già in vigore, cioè il taglio del cuneo fiscale per i lavoratori più poveri.",https://www.repubblica.it/economia/2023/11/17/news/manovra_2024_promesse_governo_meloni-420545967/?ref=RHLF-BG-I420551616-P1-S1-T1
"Former CGIL leader Sergio Cofferati: ""This right wing is questioning rights: you can't back down.""",3,"ROMA — Sergio Cofferati, ex leader della Cgil, lo scontro governo-sindacato ci rivela qualcosa di nuovo?«Magari non esplicitato, ma c’è. Si coglie un fastidio del tutto evidente».Cosa dà fastidio?«La capacità, del sindacato, di radunare consenso attorno alle proprie opinioni. E di disporre, nel caso, di uno strumento forte come lo sciopero, che è l’esplicitazione della democrazia nel mondo del lavoro.«In parte sì. Vi colgo il tentativo di mettere in discussione il diritto di sciopero».È quello l’obiettivo di Salvini?",https://www.repubblica.it/economia/2023/11/16/news/cofferati_cgil_sciopero_generale-420541371/?ref=RHLF-BG-I420551616-P1-S2-T1
"General strike, square challenge today: 'Protest for jobs and pensions'. What you need to know",3,"Prima protesta di Cgil e Uil contro la legge di bilancio: i segretari a Roma, cortei in tutto il Centro. A fine mese Sud e Nord. Stop dei trasporti nazionale ridotto a quattro ore per evitare sanzioni. Ma la battaglia legale contro la precettazione va avanti. Roma — Landini e Bombardieri a Roma in piazza del Popolo, manifestazioni anche a Perugia, Ancona, Campobasso, Pesaro, Macerata, Fermo, Ascoli Piceno, Lanciano e Firenze.

Le contestazioni della Commissione di Garanzia e la precettazione del ministro dei Trasporti Salvini non fermano Cgil e Uil: oggi, nelle Regioni del Centro Italia, il primo degli scioperi generali contro la legge di Bilancio e a sostegno dei lavoratori, dei giovani e dei pensionati.",https://www.repubblica.it/economia/2023/11/17/news/il_giorno_dello_sciopero_in_piazza_per_lavoro_e_pensioni-420545178/?ref=RHLF-BG-I420551616-P1-S3-T1
Wage increases in Italy are a third slower than in the rest of Europe and do not beat inflation,2,"La banca britannica Barclays stima nel terzo trimestre una crescita del 3% dei “salari negoziati” nostrani, contro un 4,4% medio in Europa e fino all’8% in Austria, Olanda, Belgio. E da gennaio le paghe rallentano per il calo dei prezzi.MILANO — Il governo di destra stronca una volta per tutte il salario minimo in Italia: ma anche con quelli medi non ce la passiamo bene. Il Paese, dove la produttività è zero da un quarto di secolo (anzi -0,1%, dato Istat), è ormai da anni nelle retrovie per crescita delle retribuzioni. Anche gli “aumenti negoziati” di quest’estate — attorno al 3%, per compensare il balzo dell’inflazione — sono sotto la media, che uno studio di Barclays ha stimato al 4,5% in Europa: e stanno per frenare.",https://www.repubblica.it/economia/2023/11/17/news/barclays_in_italia_laumento_dei_salari_e_un_terzo_piu_lento_che_nel_resto_deuropa_e_non_batte_linflazione-420546747/?ref=RHLF-BG-I420552404-P2-S1-T1
"Giulia Cecchettin and Filippo Turetta, missing ex-boyfriends yellow: photo of car heading to Austria, someone covers up escape?",1,"L’auto di Filippo Turetta potrebbe aver superato i confini per proseguire la sua fuga all’estero. La Fiat Punto nera svanita nel nulla da sabato sarebbe stata avvistata l’ultima volta ieri mattina alle 9,30 a San Candido, in Alto Adige, in direzione Austria. Non vi è certezza, è bene precisarlo, che l’auto al momento più ricercata del Paese abbia effettivamente lasciato l’Italia, ma comunque le autorità hanno diramato l’alert anche alle forze di polizia estere e, in particolare, a quelle austriache. È l’unica notizia, al momento, sulla vicenda dei due ex fidanzati scomparsi: Giulia Cecchettin, 22enne di Vigonovo (Venezia), e l’ex fidanzato Filippo Turetta, anche lui 22 anni, di Torreglia (Padova). Decine le segnalazioni arrivate in questi giorni nelle caserme del Triveneto. Molte però si sono rivelate infondate. I passaggi finora confermati parlano di un tragitto di quattro giorni attraverso tre regioni fino ad arrivare al confine con l’Austria.",https://www.ilmattino.it/schede/giulia_cecchettin_scomparsa_filippo_turetta_fuga_austria_cosa_sappiamo_davvero-7759550.html
"Alex Schwazer, niente Olimpiadi di Parigi 2024: la decisione della Wada durante il Grande Fratello",2,"La decisione da parte dell'Agenzia Antidoping per Alex Schwazer è arrivata durante la diretta del Grande Fratello. L'atleta non potrà qualificarsi per i Giochi di Parigi 2024 a seguito del rifiuto da parte della Wada dello sconto della lunga squalifica per doping con scadenza il prossimo luglio. «Sarò sintetico la decisione mi è stata annunciata dopo due anni e non è stata favorevole, sono dispiaciuto, ritengo sia profondamente sbagliata perchè non è presa in maniera neutra ma credo di pagare il fatto di non aver mai accettato il verdetto della giustizia sportiva e aver lottato per la mia innocenza. Io sono qui da dieci settimane con voi ho sempre dato il massimo come mia moglie e bimbi sempre presenti nei miei allenamenti, non ho rimpianti. Nei prossimi giorni valuterò i passi da fare sia sulla mia permanenza che sulla squalifica, vi chiedo di non fare drammi, la vita è bella andiamo avanti così e speriamo che anche questa sera il tugurio rimarrà chiuso», ha detto Schwazer.",https://www.ilmattino.it/primopiano/cronaca/alex_schwazer_grande_fratello_wada_olimpiadi_doping-7760498.html
"Florenzi and betting, the player in Prosecutor's Office: I used to play on roulette and never on soccer. Lawyers: he bet on illegal sites.",2,"Scommesse sì, ma mai sul calcio e solo su altri giochi, tra cui la roulette. Questo è quanto avrebbe riferito Alessandro Florenzi oggi a Torino nel corso dell'interrogatorio reso in procura alla pm Manuela Pedrotta e agli investigatori della squadra mobile. Florenzi è stato ascoltato in veste di indagato. È durato all'incirca un'ora l'incontro in procura: al termine, il giocatore del Milan ed ex Roma (che si è presentato in qualità di indagato) ha lasciato il palazzo di giustizia passando per un percorso ricavato sul tetto del complesso. «Alessandro Florenzi è stato ascoltato dal Pubblico Ministero Dott.ssa Manuela Pedrotta chiarendo la propria posizione e ribadendo la assoluta estraneità a qualsiasi tipo di scommessa sul calcio, né del resto è emerso alcun indizio o contestazione in tal senso. Ha altresì riconosciuto di aver giocato su piattaforme illegali ed ha fornito tutti i chiarimenti richiesti al Pm per definire la propria posizione al più presto». Così in una nota gli avvocati del giocatore, Antonio Conte Gianluca Tognozzi, alla fine dell'audizione alla Procura della Repubblica di Torino dopo l'iscrizione sul registro degli indagati dell'esterno del Milan con l'accusa di scommesse su piattaforme illegali.",https://www.ilmattino.it/primopiano/cronaca/florenzi_scommesse_indagine_cosa_ha_detto_calcio_roulette_oggi_torino-7760225.html
Mom dies at 34 at beach: struck by lightning while walking,1,"Morta mentre passeggia in spiaggia. Froilanis Maireth Rivas Roman, 34 anni, stava passeggiando tranquillamente sulla spiaggia di Boquilla a Cartagena, in Colombia, quando si è verificato il tragico incidente.La tragedia in un video chocNei filmati delle telecamere a circuito chiuso si vede perfettamente la donna, mamma di due bimbi, passeggiare ignara sulla spiaggia e pochi istanti dopo un lampo bianco colpirla, la donna è immediatamente caduta a terra senza vita.Le riprese fatte dai passanti mostrano il corpo morto di Froilanis steso sulla sabbia, completamente inerme, si sentono alcuni passanti gridare: «È morta. Il fulmine l'ha uccisa all'istante. Non possono toccarla». La tragedia è avvenuta ore dopo che le autorità divulgassero un'allerta maltempo, invitando i cittadini a prendere le dovute precauzioni. Anche i bagnini della spiaggia, avevano chiesto poco prima ai bagnanti di sgrombrare l'area circostante.",https://www.leggo.it/esteri/news/mamma_uccisa_fulmine_spiaggia_16_11_2023-7760141.html
"Superenalotto, Lotto and 10eLotto draws of Thursday, November 16, 2023: hit the 6 from 85 million in Rovigo. All winning numbers and odds",5,"Lotto, Superenalotto e 10eLotto, estrazioni di oggi, giovedì 16 novembre 2023: su Leggo.it in diretta a partire dalle ore 20 tutti i numeri vincenti in tempo reale, con il jackpot del Superenalotto da sogno di 85,1 milioni di euro. Dopo le 20 tutti i numeri vincenti, a seguire le quote. Nell'estrazione di oggi è stato centrato il 6 al Superenalotto. Lotto, l'estrazione di oggi: dalle ore 20 in diretta su questa pagina minuto per minuto le estrazioni dei numeri del Lotto del concorso di oggi giovedì 16 novembre 2023. Saranno disponibili tutti gli estratti sulle dieci ruote del Lotto più quella Nazionale comunicati dall'Agenzia delle Dogane e dei Monopoli. Le estrazioni del Lotto si tengono ogni martedì, giovedì e sabato. Da luglio si è aggiunta l'estrazione del venerdì. Sul sito di Leggo.it è presente inoltre l'archivio di tutte le estrazioni del Lotto del 2020 e del 2021 e 2022.LOTTO, LE RUOTE BARI 82 41 20 37 35 CAGLIARI 86 3 33 20 40 FIRENZE 62 80 6 46 8 GENOVA 34 33 46 80 56 MILANO 54 46 34 9 67 NAPOLI 27 38 12 58 85 PALERMO 55 60 16 64 87 ROMA 34 68 46 66 86 TORINO 33 34 19 49 3 VENEZIA 71 43 53 6 27 NAZIONALE 5 66 16 85 34",https://www.leggo.it/schede/estrazioni_lotto_superenalotto_10elotto_oggi_16_novembre_2023-lotto_le_ruote-3-7759809.html
"Single cheque, EU sends infringement letter to Italy. What it means and what could change",1,"La Commissione Ue ha inviato al governo italiano la lettera con parere motivato che contesta l'assegno unico introdotto nel marzo dell'anno scorso. L'invio della missiva comporta un avanzamento della procedura di infrazione nei confronti di Roma. Secondo la Commissione, «la legislazione viola il diritto dell'Ue in quanto non tratta i cittadini europei in modo equo, il che si qualifica come discriminazione».Assegno unico, il dettaglio della letteraSpiega nel dettaglio la Commissione di aver deciso di inviare il parere motivato all'Italia sull'assegno unico e universale per i figli a carico, introdotto nel marzo 2022, per il mancato rispetto delle norme dell'Ue in materia di coordinamento della sicurezza sociale e di libera circolazione dei lavoratori.Cosa significaPossono beneficiarne solo coloro che risiedono per almeno due anni in Italia, e solo se vivono nello stesso nucleo familiare dei figli. Secondo il parere dell'esecutivo comunitario questa normativa viola il diritto dell'Ue, in quanto non tratta i cittadini dell'Unione in modo equo, e pertanto si qualifica come discriminazione. Il regolamento sul coordinamento della sicurezza sociale, ricorda la Commissione, vieta inoltre qualsiasi requisito di residenza ai fini della percezione di prestazioni di sicurezza sociale, quali gli assegni familiari. Cosa cambia ora Bruxelles aveva inviato a febbraio 2023 una lettera di costituzione in mora, cui l'Italia ha risposto a giugno. L'esecutivo comunitario spiega ora di ritenere che «la risposta non affronti in modo soddisfacente i suoi rilievi». L'Italia ha due mesi per rispondere e adottare le misure necessarie, trascorsi i quali la Commissione potrà decidere di deferire il caso alla Corte di giustizia dell'Ue.",https://www.leggo.it/economia/news/assegno_unico_lettera_infrazione_ue_cosa_significa_cosa_succede_ora_oggi_16_11_2023-7760385.html
"Christmas 2023, colors, decorations and tree: here are all the trends",4,"Manca poco più di un mese. E già si intravedono segni e simboli. Dopotutto è il momento più atteso dell'anno: quello in cui è possibile ritrovarsi con la famiglia, lontani da impegni e routine. Il Natale si avvicina e impazza la corsa ad addobbare case, città e negozi. Alcuni vip, a partire da Chiara Ferragni, hanno già terminato gli addobbi per Natale 2023. Ma vediamo quali sono i colori più trendy e le tendenze di quest'anno?L'intramontabile: il rossoIl rosso è sicuramente il colore che incarna lo spirito del periodo delle festività natalizie. Nel 2023-2024 sarà più che mai presente nelle decorazioni. Le tradizionali palline, i nastri e le ghirlande rosse abbelliranno l'albero con eleganza e nel rispetto della tradizione. Abbinato a tocchi in oro o argento, il rosso è sicuramente un must. Gli altri colori di tendenza
Invernale e simbolo di purezza, il bianco è uno dei colori che meglio si abbina al rosso. Così come il verde, che è, da sempre, uno dei colori del Natale. Quest'anno tornerà ad occupare un posto importante nell'addobbo natalizio, distinguendosi nelle sue varie tonalità (verde pistacchio, verde salvia o verde abete).

Ma nell'elenco ci sono anche altri colori, come il blu (vapore, notte e turchese); il viola e il marrone (nella tonalità del marrone caffè e il marrone rame).",https://www.leggo.it/schede/natale_2023_addobbi_colori_albero_tendenze_oggi_16_11_2023-gli_altri_colori_di_tendenza-3-7760480.html
"Andrea Cerioli, anxiety over health problems: ""I'm exhausted, here's what I'm suffering from and why""",2,"Andrea Cerioli negli ultimi tempi non è al meglio delle sue forze. L'ex tronista di Uomini e Donne, ha passato le ultime settimane ad entrare e uscire dagli ospedali, la settimana scorsa aveva parlato di una forte gastrite, questa volta ha deciso di spiegare in modo chiaro ai suoi follower i problemi di salute.Il racconto Cerioli soffre da quasi due anni e mezzo di coliche addominali e sta volta ha deciso di raccontare tutto il suo iter medico sui social. I problemi sembrano essere iniziati con la pandemia: «Sono davvero esausto da questo periodo. Torniamo indietro di 2 anni, prima dell'isola eravamo in quarantena, e come tutti, o quasi... mi sono goduto la casa e soprattutto la cucina, ingrassai molto, arrivò improvvisamente isola, e come vi ricorderete arrivai bello pienotto... persi 26kg in 80 giorni, uscito da lì ""errore mio"" tornai a mangiare come prima, cosa sbagliatissima perché bisognerebbe integrare lentamente e in bianco, pensate che sul volo di ritorno chiamarono un medico a Città del Messico perché mi senti malissimo dopo una mangiata in aeroporto, ma ripeto, errore mio, dopo 80 giorni, la fame era davvero tanta, fame vera».  A questo punto, Andrea Cerioli racconta di aver poi ripreso 28/29 kg in poco più di un mese, che gli hanno causato dei problemi al fegato. L'ex tronista ha poi detto di essersi curato, ma negli ultimi mesi la situazione è tornata ad essere critica: «Tac ed ecografia confermano problema alla coleciste per il resto tutto ok.Stamattina ho fatto gastroscopia, ho bile nello stomaco ed un ernia iatale che sicuramente complica il dolore dato dallo scarico di bile nello stesso».  Cerioli sta aspettando ulteriori accertamenti per sapere come curarsi al meglio.",https://www.leggo.it/gossip/news/andrea_cerioli_salute_come_sta_16_11_2023-7760237.html
