translated_title,score,text,source
First Eurocamera green light for new Euro 7 standards,4,"Con 52 voti a favore, 32 contrati e un astenuto, la commissione Ambiente dell'Europarlamento ha approvato la sua posizione sul nuovo regolamento Euro7 per ridurre le emissioni inquinanti e stabilire i requisiti di durata delle batterie per autovetture, furgoni, autobus e camion.""La Commissione europea è stata informata che la Tunisia ha restituito il pagamento da 60 milioni di euro"" dell'esecutivo comunitario. ""Questo non cambia il fatto che continueremo il lavoro sui cinque pilastri del memorandum of understanding"". Lo ha detto la portavoce della Commissione Ana Pisonaro. Il pagamento ""non era collegato al Memorandum"", ha sottolineato. ""Si trattava di un precedente programma di sostegno al bilancio che sosteneva la ripresa economica dall'emergenza Covid-19. E quando si tratta di come portare avanti l'attuazione del Mou, sono in corso contatti"" e ""le discussioni continuano"".",https://www.leggo.it/speciali/quieuropa/primo_via_libera_dell_eurocamera_ai_nuovi_standard_euro_7-7688536.html
Baby goat kicked to death at birthday party: six boys face trial,1,"Sei maggiorenni e un minorenne,: due hanno ucciso e cinque hanno istigato senza provare nemmeno a fermarli, anzi inquadravano la scena con i loro smartphone e facevano a gara per pubblicare i video sui social. Ne è convinta la Procura della Repubblica di Frosinone che ha inviato l'avviso di conclusione delle indagini a sei ragazzi accusati di essere coinvolti nel caso della capretta uccisa a calci durante una festa di compleanno in un agriturismo di Anagni lo scorso 27 agosto.Per un settimo ragazzo, di 16 anni, si procede separatamente alla Procura dei Minori di Roma. Per lui ed uno dei maggiorenni l'accusa ipotizzata è quella di uccisione di animali. Per gli altri si ipotizza invece il reato di istigazione a delinquere per avere incitato i primi due a continuare a colpire la capretta fino ad ucciderla mentre filmavano con i cellulari. Furono proprio quei video caricati sui social fa far scoppiare il caso. Il gestore dell'agriturismo non si era accorto di nulla: aveva trovato la capretta morta solo l'indomani mattina.Addirittura stava per avvertire il veterinario perché pensava ad un avvelenamento legato a qualcosa che l'animale aveva ingerito. Invece i video mostravano la brutalità del branco di ragazzini.Nelle immagini si vede il sedicenne di Fiuggi sferrare un calcio violentissimo alla capretta inerme a terra. Altri colpi ancora. Poi insieme con il ventenne di Anagni mettono la capretta in una cesta in plastica bianca la caricano su una carriola e la lanciano da un muretto. Intorno a loro gli amici urlano di rifarlo per riprendere meglio la scena.Quattro sono di Fiuggi: tre diciottenni e un diciannovenne. Il quinto, di 18 anni, è di Anagni. Alla procura dei minori ci sono altri 6 indagati per istigazione. Assistiti dagli avvocati Giampiero Vellucci, Daniele Natalia, Filippo Misserville, Antonella Sforza, Pietro Polidori e Francesca Ruggeri, gli indagati sostengono che l'animale fosse già morto mentre lo colpivano. A supporto di questa tesi hanno indicato alcuni clienti del locale che avrebbero notato la capretta già morta prima dell'inizio del compleanno.La Procura della Repubblica di Frosinone non crede alla loro versione. E poco conta che non si trovi più il corpo della capretta: l'allevatore ha spiegato che una mattina non c'era più, forse portato via dai cinghiali. Per i magistrati, a dire cosa è accaduto sono i video. Gli stessi sui quali i ragazzi pensavano di costruire la loro reputazione poggiata sui like. ",https://www.leggo.it/italia/roma/capretta_uccisa_processo_anagni-7760193.html
"Bologna, 100 missing cats. Complaint: ""Someone set out to eliminate them all.""",1,"«Qualcuno, in Appennino, si è messo in testa di eradicare tutti i gatti. Nel Comune di Monzuno sparisce un gatto al giorno». Così il consigliere comunale di Bologna Davide Celli, delegato del sindaco di Bologna ai diritti e al benessere degli animali, commenta la sparizione del gatto di sua madre.Lo strano episodio È stato lui stesso a darne notizia via social spiegando di avere sporto denuncia ai carabinieri. Un episodio che segue altri casi simili che si sono verificati anche nei territori di Marzabotto e Gaggio Montano nelle ultime settimane. «Giovedì scorso, nel primo pomeriggio, il gatto di mia madre è uscito di casa, era nel cortile, ed è sparito. Non è il primo episodio - afferma Celli - ormai si sono perse le tracce di un centinaio di felini in Appennino. Chi li fa sparire agisce in modo preciso. Non si tratta di esponenti di una setta, non sono lupi, perché vengono visti molto di rado. È qualcuno che ce l'ha a morte con i gatti. Le autorità preposte devono fare luce su quanto sta accadendo».",https://www.leggo.it/italia/cronache/gatti_scomparsi_bolognese_15_11_2023-7758108.html
"Dog stays by dead master's body, how did Finney survive for more than 2 months? Mystery revealed",3,"Un vecchio detto dice che «il cane è l'unico essere vivente che ti ama più di quanto ami se stesso». La prova è nella storia che vi stiamo per raccontare. Rich Moore e il suo Jack Russel sono scomparsi il 19 agosto durante un'escursione al Blackhead Peak.Le ricerche dell'uomo sono terminate il 30 ottobre quando è stato trovato senza vita. Il cane era ancora al suo fianco, vivo. Ha vegliato su di lui per due mesi e mezzo senza lasciarlo. Ma come ha fatto a sopravvivere il piccolo Finney?Il ritrovamento«È stato trovato 2,5 miglia a est della cima della montagna sotto il punto in cui siamo stati inseriti», ha riferito Delinda Vanne-Brightyn della TSAR (Taos Search and Rescue).L'uomo e il cagnolino sono stati individuati grazie all'avvistamento di un cacciatore locale, che ha allertato le autorità, poco dopo una squadra è arrivata in elicottero per recuperare il corpo.Secondo quanto riferito, il cane è stato portato immediatamente dal veterinario per dei controlli, prima di potersi riunire alla famiglia.Com'è sopravvissuto Finney
Si ritiene che Finney sia sopravvissuto cacciando piccoli animali come i topi e riuscendo anche a evitare predatori come leoni di montagna, coyote e orsi, secondo la signora VanneBrightyn di di Taos Search and Rescue.

«Se quel cane potesse parlare sarebbe una storia fantastica», ha detto. «Probabilmente non potevamo nemmeno credere alla storia che il cane avrebbe raccontato».",https://www.leggo.it/schede/cane_padrone_morto_sopravvissuto_come_ha_fatto_oggi_15_11_2023-com_e_sopravvissuto_finney-2-7757619.html
"South African cobra invades a golf course, moments of fear among players: all safe",4,"Alcuni golfisti stavano tranquillamente giocando la loro la partita su un campo da golf nella capitale del Sudafrica, Città del Capo, quando un «golfista» particolare - e inaspettato - ha deciso di fare la sua apparizione. Il video, diventato virale sui social, mostra l'incontro con un esemplare di Cobra del Sudafrica, conosciuto anche come Cobra giallo: per fortuna il rettile non si è avvicinato troppo al gruppo di giocatori.Salti e sibili del terrificante serpente
Il filmato, seppu breve, riesce a far distinguere chiaramente che si tratta di un cobra. Il rettile si avvicina, minaccioso, alla persona che sta riprendendo. 

Mentre avanza, poi, si trova davanti un ostacolo del campo da golf e senza farsi intimidire procede con quello che sembrerebbe una sorta di «salto» per superarlo e poi continuandore a sibilare minacciosamente. 

Non è chiaro cosa abbia provocato il serpente. Tra i motivi potrebbe esserci la fuga  da uno degli animali che costituisce un degno avversario del cobra: la mangusta. Con uno sguardo più attento, sarà possibile vedere il mammifero nei cespugli sullo sfondo. ",https://www.leggo.it/animali/cobra_campo_golf_sudafrica_oggi_15_11_2023-7757267.html
"Usutu virus in Sardinia, new positive cases detected among birds and insects: are humans in danger?",3,"In Sardegna due storni morti a Oristano e un gruppo di zanzare catturate ad Arborea sono risultati positivi all'Usutu Virus, meno pericoloso per l'uomo rispetto alla Febbre del Nilo. A Oristano, dove sono già attive misure di prevenzione, sono in vigore le disposizioni comunali, mentre ad Arborea è stata proposta un'ordinanza per contenere la diffusione del virus. In passato, altri casi di Usutu Virus erano stati segnalati in centro della città.Il direttore del servizio della Asl 5, Enrico Vacca, ha affermato che la situazione è sotto controllo e raccomanda precauzioni simili a quelle per la Febbre del Nilo. L'Usutu Virus, trasmesso da zanzare infette, può causare sintomi sia negli uccelli che negli esseri umani, con forme asintomatiche, influenzali e, in rari casi gravi, meningo-encefaliti.",https://www.leggo.it/animali/usutu_virus_sardegna_casi_oggi_15_11_2023-7757273.html
"Milan shock, dog killed in park in front of 13-year-old owner: 'A hunter shot him in the head'",1,"Ha sparato e ucciso un cane, un rottweiler, che si trovava in un parco insieme a un ragazzino di 13 anni. È accaduto ieri pomeriggio, nell'area verde di Parabiago, provincia di Milano, a poche centinaia di metri dalle case. A raccontare l'uccisione dell'animale, è Sarah, proprietaria del cane, insieme a suo figlio, che ha assistito alla morte di Uma: «La mia migliore amica, è stata ammazzata a sangue freddo. Le hanno sparato in testa, in mezzo agli occhi», le parole piene di angoscia della donna, rivela Il Giorno.L'uccisione di Uma Ad ucciderla un uomo che le ha sparato in un «campo a 160 metri dalle case con mio figlio, un ragazzino di 13 anni, che si è visto la testa del suo cane esplodere” aggiunge Sarah, che ha definito l'uomo che ha sparato «un ‘cacciatore’ senza giubbotto catarifrangente». Ora sulla vicenda stanno facendo luce gli investigatori, a cui l'uomo avrebbe detto di aver fatto fuoco per difendersi, impaurito dal rottweiler che correva minaccioso verso di lui. ",https://www.leggo.it/italia/milano/spara_cane_davanti_ragazzino_13_anni_fuoco_vicino_case_oggi_13_11_2023-7753512.html
"Captured the lion that escaped from the circus in Ladispoli: the animal roamed among houses, panic among residents",5,"Un leone è scappato dal circo in Viale Mediterraneo a Ladispoli (Roma).Sui social circolano dei filmati di cittadini di Ladispoli, girati con il telefonino da balconi di abitazioni o dall'abitacolo di veicoli, che hanno ripreso il leone aggirarsi per alcune strade della cittadina, come nel quartiere del Cerreto. Dopo alcune ore di ricerche, il leone è stato catturato, scrive l'agenzia ANSA. L'animale, dopo aver vagato per ore nelle vie della cittadina laziale seguito a vista dalle forze dell'ordine, è stato infine sedato dalle squadre di veterinari giunte sul posto e successivamente catturato. L'appello del sindaco di LadispoliIl sindaco Alessandro Grando ha subito avvisato la popolazione, anche tramite i social: «L’animale è stato subito rintracciato all’interno del corso d’acqua adiacente - si legge su facebook -. Il personale del circo sta mettendo in atto le operazioni di cattura, con il supporto delle Forze dell’ordine che sono prontamente intervenute sul posto. Si prega di prestare la massima attenzione e di evitare gli spostamenti fino a nuova comunicazione». Le polemiche«Per quelli che cominceranno a chiedere - prosegue il sindaco - perché ancora fate venire a Ladispoli il circo con gli animali? Perché il sindaco ha autorizzato il circo? La risposta è che io non ho autorizzato nulla, non spetta a me farlo, e che purtroppo non possiamo vietare ai circhi con animali di venire nella nostra città. Nel 2017 ci abbiamo provato ma abbiamo perso il ricorso al TAR e abbiamo anche dovuto risarcire le spese legali ai ricorrenti. Finché non cambieranno le norme non potremo fare diversamente. Vi darò altre informazioni non appena mi verranno comunicate».L'intervento
L'episodio è successo intorno alle 15.40. Sul posto poliziotti, finanzieri e carabinieri della stazione Ladispoli, Civitavecchia e forestali che sono riusciti a individuare l'animale, visibilmente spaventato, intorno alle 16, in un canneto vicino al circo. L'animale, dopo aver vagato per ore nelle vie della cittadina laziale seguito a vista dalle forze dell'ordine, è stato infine sedato dalle squadre di veterinari giunte sul posto e successivamente catturato. Il panico tra i residenti
«Fate attenzione, è scappato un leone dal circo». Il panico per l'animale fuggito dal circo in viale Mediterraneo, a Ladispoli, corre sui social tra sarcasmo e auguri di libertà per il 'fuggitivò. «Io abito proprio di fronte e lo stanno cercando ma non si trova» scrive spaventata Giorgia, tra l'incredulità dei più e la rassicurazione di Giuseppe, che dice: «È vero perché stavamo andando per lo spettacolo delle 17,e non si farà». «Poveri animali. Spero non lo trovino più e che possano finire questi squallidi spettacoli», commenta Ester. «Trovata la soluzione per il sovrannumero dei cinghiali» rilancia Alvaro.",https://www.leggo.it/schede/leone_ladispoli_scappato_circo_dove_cosa_succede-7749832.html
"Palermo, shoots a cat and has it mauled by dogs: video goes viral on social media",1,"Un gatto inseguito da tre cani, colpito da un colpo di pistola e poi lasciato sbranare dai tre animali. È l'ennesimo video macabro su animali diffuso e postato su Tik tok da un uomo di Partinico, nel Palermitano. Nel video, denunciato dalla Lndc Animal Protection, si vede l'uomo, armato, che aizza tre cani, presumibilmente di sua proprietà, all'inseguimento di un gatto indifeso. Il gatto riesce ad arrampicarsi su un albero ma l'uomo gli spara, facendolo cadere al suolo e lasciandolo sbranare dai tre cani.Il commento sul gesto«Non gliela faremo passare liscia. Questo cacciatore, perché non saprei in quale altro modo definire un uomo armato che si accompagna a cani chiaramente abituati a praticare questo tipo di attività, deve pagare per quello che ha fatto - afferma Piera Rosati, presidente di Lndc Animal Protection - La vittima non è solo questo gatto, ma anche tutte le altre creature che ha perseguitato nel corso del tempo. Oppressi, sono anche i cani che ha usato per i suoi folli scopi. È evidente che per quest'uomo si è sempre e solo trattato di un divertimento, di un passatempo meritevole di essere documentato e condiviso pubblicamente sui social. Non riesco a comprendere la mente di persone così. Spero vivamente che la nostra denuncia, per il reato di uccisione di animale, renda giustizia alle tante vittime di quest'uomo. Non possiamo permettere che passi il concetto di una bravata da social, deve essere chiaro che si tratta bensì di un atto vile che costituisce reato»",https://www.leggo.it/italia/cronache/spara_gatto_cane_video_social_09_11_2023-7745643.html
"Pink Panther-colored cat outrages social: ""A stupid idea, may feel bad""",3,"Sui social c'è chi scherza e scrive commenti ironici, guardando il video di questo gatto color rosa Barbie che cammina su un marciapiede in Messico, con la colonna sonora della Pantera Rosa. Ma c'è anche chi si indigna, perché, ovviamente quello non è il suo color naturale, piuttosto l'effetto di una verniciatura. Le critiche sui social
 
Tra i commenti indignati, però, c'è chi si mette dalla parte dell'animale e scrive: «Un'idea assolutamente stupida, anche se la vernice non è tossica». Infatti, nel video, si vede che quando il gatto gira il muso, una parte è bianca, il suo colore naturale.
Altri utenti di TikTok, si sono anche preoccupati per la salute del gatto, perché leccandosi potrebbe assorbire la tintura della vernice e sentirsi male. Infatti le tossine presenti nei coloranti possono avere effetti nocivi sulla loro salute e, in casi estremi, persino portare alla morte. In Messico, tra l'altro le pene per chi fa del male ad un animale sono molto severe, in caso di uccisione si arriva anche alla pena detentiva.",https://www.leggo.it/esteri/news/gatto_pantera_rosa_indigna_social_idea_stupida_video_oggi_8_11_2023-7743315.html
"Bitter Bear, Abruzzo National Park: ""Cubs are doing well after mother killed""",4,"La storia dell'orsa Amarena, uccisa perchè si era avvicinata troppo ad una casa, ha colpito e commosso l'Italia intera: in molti sono anche scesi in piazza per chiedere giustizia per la sua morte e nuove regole per la convivenza fra esseri umani e orsi. A preoccupare gli animalisti italiani anche la sorte dei due cuccioli di Amarena, rimasti soli quando avevano circa 8 mesi: si temeva infatti che non sarebbero riusciti a sopravvivere in natura senza la mamma. In questi giorni la buona notizia, che arriva direttamente dal Parco nazionale d'Abruzzo, Lazio e Molise: i giovani orsi di Amarena stanno bene e crescono.Ora però il problema possono diventare i cacciatori: l'Oipa chiede di vietare l'attività venatoria nelle aree frequentate dai due cuccioloni.",https://www.leggo.it/animali/orsa_amarena_i_cuccioli_stanno_bene_ma_vanno_difesi-7739018.html
"Tiktoker student in tears: ""Too much studying, I can't do it."" But anger explodes among the comments",2,"Un pianto di rabbia, per esprimere una forte denuncia sociale. Un'intrepida tiktoker, sopraffatta dal troppo studio, ha scelto di sfogarsi con i suoi follower, per trovare il supporto morale di cui ha bisogno. Il video ha fatto il giro del web, risultando alquanto divisivo: da un lato, c'è chi ha compreso il suo dolore, dall'altro, tante persone che l'hanno criticata per lo scarso impegno in ambito accademico.Il videoIl trucco colato e la voce rotta dal pianto: così si è presentata ai suoi follower la giovane Vittoria, studentessa sull'orlo di una crisi di nervi. La tiktoker, nel video, si lamenta della mole di studio che deve fronteggiare nel corso della settimana scolastica: «Ragazzi ve lo giuro, mi fanno male gli occhi per quanto sto piangendo...». Vittoria spiega il suo dramma: «Domani ho il compito di italiano, mercoledì quello di fisica, giovedì un'interrogazione di inglese, venerdì compito di spagnolo e l'interrogazione di italiano, sabato compito di giapponese.Chiedetemi come mi sento!». 
Le reazioni
Il video ha raggiunto oltre 2 milioni di visualizzazioni, suscitando reazioni contrastanti. Uno dei più critici ha scritto: “Studia, invece di piangere su TikTok”. C'è chi, addirittura, ha messo in dubbio la sincerità della tiktoker: “Ma mettersi chili di mascara per far vedere le lacrime va di moda?”.",https://www.leggo.it/italia/cronache/studentessa_tiktoker_troppo_studio_video_oggi_15_11_2023-7757870.html
Prof proposes to colleague in class (with the help of students): exciting video,5,"Stava per cominciare la sua lezione in classe, quando è stata interrotta da... una proposta di matrimonio. È successo a Peschici, in Puglia. Un professore del liceo ha sorpreso la compagna (e collega), si è messo in ginocchio e le ha fatto la fatidica proposta. A supportarlo, anche i suoi studenti, che uno alla volta hanno consegnato diverse rose all'insegnante. Il video è stato pubblicato da uno studente su TikTok ed è diventato subito virale. ",https://www.leggo.it/scuola/news/proposta_matrimonio_classe_prof_studenti_video_oggi_15_11_2023-7757797.html
"Maturity repeated, same grade for appeal girl: nightmare over for fifth A",4,"Commissioni diverse, ma voto uguale. Ha ottenuto la stessa valutazione la studentessa del liceo linguistico scientifico Galileo di Spadafora (Messina) che con il suo ricorso ha fatto ripetere l'esame orale di maturità a tutta la sua classe. Le decisioni delle due diverse commissioni d'esame sono sovrapponibili: la studentessa ha superato la maturità con lo stesso voto ottenuto la prima volta.La doppia maturitàStress finito gli studenti della Quinta A che sembrano i protagonisti di 'Immaturi', ma il loro non è stato un film. Tutt'altro. Come dimostra l'applauso, liberatorio, di studenti e genitori che ha accompagnato la fine dell'esame sostenuto per la seconda volta per decisione del Tar, dopo che l'Ufficio scolastico regionale della Sicilia aveva individuato irregolarità, confermate dai giudici. E nella foto finale dove ci sono nove degli undici esaminandi. Del caso si era interessato il ministero dell'Istruzione e del merito che, come ha detto il ministro Giuseppe Valditara, «aveva già fatto tutte le sue verifiche» e che «aveva già affrontato il tema». Stamattina gli ultimi due esami. A chiudere è stata la studentessa la cui famiglia aveva presentato il reclamo dopo gli esiti finali della maturità: promossa, ma con un voto che, secondo il ricorso, non rispecchiava il percorso scolastico e perché sfavorita rispetto agli altri nove compagni di classe. Ma l'esito non è cambiato, il voto è stato lo stesso della precedente commissione.L'avvocato«L'esame orale - ricostruisce il legale della famiglia della studentessa, l'avvocato Maria Chiara Sgrò - era stato illegittimamente concordato con il commissario interno: avrebbero saputo con giorni di anticipo gli argomenti di inizio esame ed è, invece, avvenuto che solo alla mia assistita è stato richiesto dalla commissione un argomento di inizio esame difforme rispetto a quanto concordato con lo stesso commissario interno». Secondo il legale «l'inaspettata sorpresa ha provocato il disorientamento della giovane, che ha generato una prolungata crisi emotiva, compromettendo lo svolgimento della prova orale, con conseguente valutazione gravemente insufficiente e inevitabile incidenza sul voto finale che le era stato attribuito». L'avvocato Sgrò smentisce anche la ragazza «avesse un curriculum mediocre, come da qualche controinteressato falsamente affermato ai Tg, avendo una media di presentazione pari a 7,46/10, oltre 33 crediti maturati nel corso del triennio» e «aveva già ottenuto buoni voti negli scritti dell'esame di italiano e di inglese». E i ritardi nella ripetizione degli esami, aggiunge, sono dovuti «al ricorso al Tar presentato dagli altri studenti».I compagniAntonio, portavoce degli altri compagni, afferma che la classe «ha sostenuto l'esame con onestà, sincerità e tranquillità». «Ringraziamo la Commissione per averci messo a nostro agio - ha aggiunto alla presenza dei legali dei ragazzi, gli avvocati Caterina Galletta e Andrea Fiore - il Galileo non è solo la scuola del ricorso. Noi viviamo a testa alta e per questo bisogna fare chiarezza dicendo la verità, ovvero che tutti noi siamo stati trattati nello stesso modo».",https://www.leggo.it/italia/cronache/doppia_maturita_ricorso_esito_11_11_2023-7749947.html
"Maturity to be redone like in the movie Immaturi: a student's parents got a repeat of the oral test. ""It's a nightmare.""",2,"Sembra proprio la trama del film di Immaturi, quello che sta accadendo ad alcuni studenti del Liceo scientifico ""Galileo Galilei"" di Spadafora, provincia di Messina, costretti a ripetere gli esami di maturità, perché sarebbero emerse irregolarità nella sessione di luglio. A dare impulso alla maturità bis, la segnalazione presentata dai genitori di una studentessa, che avrebbero denunciato presunte irregolarità durante la prova orale, scrive La Repubblica.Voto troppo bassoI genitori, insoddisfatti del voto della figlia, hanno puntato il dito contro una docente di storia e filosofia ed affidato ad un legale il ricorso che ha portato all'intervento dell'ufficio scolastico regionale, che dopo le opportune ispezioni, ha convinto le autorità scolastiche ad annullare le prove orali, rendendo necessaria la ripetizione.Si torna in classeIn questi giorni sono iniziate le prove orale, e nonostante la tensione palpabile, gli studenti finora esaminati hanno dimostrato di aver preparato diligentemente le materie, beneficiando di un'atmosfera rassicurante creata dalla Commissione. L'ultima sessione prevista per sabato, vedrà coinvolta la studentessa che ha presentato la denuncia, mentre la mamma di un'altra alunna, che ha difeso gli studenti in qualità di genitore e legale, lamenta il fatto che sua figlia si fosse diplomata con 100, voto che spera venga confermato.",https://www.leggo.it/scuola/news/maturita_da_rifare_film_immaturi_liceo_spadafora_messina_oggi_10_11_2023-7747324.html
"School, fighting bullying: older students will tutor younger ones. Here's where",5,"""Bro e Sis"", questo è il nome dell' iniziativa lanciata da una scuola di Foggia che mira a guidare gli alunni nel passaggio tra la scuola media e la prima superiore. Proprio come un fratello o una sorella maggiore, a ogni classe di primo liceo verranno assegnati due alunni di quarta e quinta liceo il cui compito sarà guidare i più piccoli a iniziare il percorso liceale.Il progetto della scuola di FoggiaSaranno infatti 22 gli studenti scelti per aiutare i più piccoli con consigli e pillole su come affrontare questo importate passaggio, una politica che verrà attuata per ridurre il bullismo nelle scuole con lo scopo ultimo di sconfiggerlo del tutto. Aiutare le matricole tramite il dialogo tra studenti e docenti potrà scoraggiare situazioni di prevaricazione, e l'educazione alla gentilezza potrà fare in modo che il rapporto tra gli alunni migliori esponenzialmente. Instaurare un rapporto di tipo fraterno è la soluzione più adatta a questo problema e la preside dell' istituto ripone in questa iniziativa numerose speranze.",https://www.leggo.it/italia/cronache/bullismo_giovani_tutor_scuola_foggia_oggi_7_11_2023-7741451.html
