translated_title,score,text,source
"Heather, missing for months: body was in partner's freezer. ""I didn't know where to throw it.""",1,"Il corpo di una donna, scomparsa da mesi, è stato ritrovato nel frigorifero del suo fidanzato, in forte stato di decomposizione in un caso che ha scioccato la comunità. È successo nella cittadina di McKinney, capoluogo della contea di Collin, in Texas: secondo quanto riferiscono i media americani.Chi è la vittimaTammara, la madre di Heather Schwab, si era rivolta alla polizia a giugno per comunicare che la figlia non dava notizie da mesi e che aveva una relazione violenta con il fidanzato, Chad Christopher Stevens. Il caso è rimasto irrisolto fino al 3 novembre, quando Tammara è tornata alla polizia per dire che l'ex moglie di Stevens e sua figlia avevano informazioni chiave sulla scomparsa: a quanto pare aveva detto loro che Heather era morta e sepolta nel suo giardino. Dopo questa scoperta, è stato trovato il corpo di Heather. Stevens, 42 anni, ha detto alla polizia che Heather, 35 anni, è morta in casa sua a giugno 2022 e che non sapeva cosa fare del suo corpo. È stato quindi arrestato sul posto con l'accusa di manomissione delle prove. E, dal momento dell'arresto, ha fornito diverse versioni sulla scomparsa di Heather. Prima dicendo che è morta dopo essere scivolata nella doccia battendo la testa; poi che non aveva più contatti con lei da un anno. La madre della vittima ha detto agli investigatori che la figlia era maltrattata dal fidanzato e che Heather le aveva detto più volte che sentiva che Stevens prima o poi l'avrebbe uccisa. Al momento è in corso l'autopsia per determinare le cause del decesso.La macabra scopertaTre giorni fa, la polizia di McKinney ha ottenuto un mandato di perquisizione per l'abitazione di Stevens, all'interno del quale ha trovato un frigorifero nella cucina coperto da «abbondanti» quantità di involucri di plastica.",https://www.leggo.it/esteri/news/heather_schwab_scomparsa_cadavere_freezer_oggi_16_11_2023-7760047.html
"""Artificial intelligence is racist and fatphobic, here's the proof"": social complaint",1,"La diffusione dell'intelligenza artificiale in varie aree della nostra vita sta creando, da diverso tempo, una serie di discussioni sul giusto utilizzo di queste nuove tecnologie e sulle problematiche che ne scaturiscono. Abbiamo assistito, per esempio, alle proteste degli artisti di tutto il mondo che hanno visto i propri lavori inseriti  – senza permesso – in enorme banche dati da cui attingere per affinare l'algoritmo delle IA e far sì che il processo di apprendimento fosse migliore e più accurato.  Nella situazione presente, l'intelligenza artificiale viene accusata di razzismo, e anche di grassofobia. Vediamo qual è la prova. Intelligenza artificiale, la dichiarazione choc di uno scienziato: «La singolarità potrebbe avverarsi nel 2031»

Il risultato inaspettato
La polemica riguarda un filtro di TikTok che, a partire dalla foto della ragazza, ne genera una completamente diversa eliminando alcune loro caratteristiche fisiche per renderle delle generiche donne bianche caucasiche. Si tratta di AI studio photo ed è stato utilizzato oltre 4 milioni di volte per trasformare l'aspetto in modo da ottenere una foto dall'aspetto professionale e retro, come fosse stata scattata negli anni '40. In base ai risultati ottenuti da molti utenti, tuttavia, sembra che l'intelligenza artificiale abbia una chiara preferenza. ",https://www.leggo.it/esteri/news/intelligenza_artificiale_razzista_grassofobica_oggi_16_11_2023-7760017.html
"Davide Ferrerio, assailant (sentenced to 20 years) appeals, ""That girl was my thing, he shouldn't have come near her""",2,"È passato più di un anno dall'aggressione che ha ridotto in fin di vita Davide Ferrerio. L'11 agosto 2022, il 20enne bolognese è stato massacrato di botte a Crotone. Da quel giorno, non si è più ripreso. Per questa aggressione, Nicolò Passalacqua è stato condannato a 20 anni e 4 mesi di reclusione in primo grado.L'aggressione sarebbe dovuta a una ragazza, alla quale Ferrerio si sarebbe avvicinato. Il 23enne ha fatto appello contro la decisione dei giudici e ha ribadito che «nessuno si doveva avvicinare a quella donna perché era cosa mia», riporta il Corriere. Il giovane è in coma vegetativo. Davide Ferrerio è in coma vegetativo. Il dolore di mamma Giusy: «Quella donna sapeva che la figlia chattava con tutti»Il processoIl prossimo 24 gennaio si terrà l'udienza d'appello per Nicolò Passalacqua. Il suo avvocato, Salvatore Iannone, ha descritto l’azione del suo assistito come «un’aggressione che voleva solo percuotere, anche con la forza, il giovane antagonista, facendogli capire che quella ragazza era “cosa sua” e nessuno poteva avvicinarsi».Anche la gip ha confermato le intenzioni di Passalacqua di voler ""marcare il territorio"" intorno a quella ragazza. «L’aggravante dei motivi abbietti — scrive la gip — è avvalorata, infatti, dal voler difendere ciò che è suo, infliggendo una punizione esemplare a colui che aveva cercato un approccio con la ragazza che stava frequentando». Come sta Davide FerrerioAttualmente Davide Ferrerio è in coma vegetativo in ospedale, costantemente assistito dai genitori e dal fratello.",https://www.leggo.it/italia/cronache/davide_ferrerio_nicolo_passalacqua_processo_appello_condanna_cosa_mia_oggi_16_11_2023-7759932.html
"Garisenda, technicians immediately to work: 'Situation significantly aggravated'. Mayor: no to alarmism about possible collapse",5,"A Bologna preoccupa Garisenda,  simbolo della città emiliana insieme alla Torre degli Asinelli e da tempo sotto osservazione per la sua «ineludibile condizione di grande criticità». Una situazione che nell'ultimo periodo – come ha messo nero su bianco il comitato tecnico scientifico, che ha consegnato la sua relazione al sindaco Matteo Lepore – si è «purtroppo sensibilmente aggravata». Abbastanza per far scattare tutta una serie di misure per il monumento che al momento non è «a rischio crollo immediato», ha rassicurato Lepore, ribadendo che la situazione è da «allerta gialla», come previsto dal piano di protezione civile illustrato la scorsa settimana.Le precauzioni del ComuneTutti i cittadini che vivono o lavorano nel raggio di 100 metri dalle torri devono essere registrati dalla Protezione civile e dalla polizia locale. In caso di movimenti anomali della torre, rilevati dai nuovi sensori posizionati sull'edificio tre settimane fa, saranno avvisati tempestivamente e evacuati. Per il momento però «non abbiamo motivo di incrementare la soglia di allerta e continuiamo a lavorare come già avevamo impostato il nostro percorso».Cosa va fattoNella relazione gli esperti ricordano come il Comune di Bologna abbia «adottato un piano di protezione civile» per la Garisenda, «che contempla tra i vari scenari anche la possibilità di crollo improvviso ed imprevedibile».",https://www.leggo.it/italia/cronache/garisenda_tecnici_subito_lavoro_bologna_oggi_16_11_2023-7760365.html
"Jovanotti: ""I can't walk without crutches."" Singer alarms fans, how he's doing after bike accident",2,"Lorenzo Jovanotti è ancora alle prese con la fisioterapia, dopo l'incidente in bici avuto ormai quattro mesi fa a Santo Domingo. Il cantante ha subito la frattura di femore e clavicola ed è dovuto rimanere lì per qualche tempo a causa dei rischi per la salute.Ad agosto Jova è tornato in Italia per seguire la terapia al centro di fisioterapia a Forlì e nelle ultime ore è tornato a parlare dell'accaduto. «Sono passati quattro mesi dal botto», ha sottolineato il cantante in un video sul suo profilo Facebook. Ma andiamo a vedere tutto nel dettaglio. Non cammino ancora senza stampelle ma conto per dicembre di cominciare. Per ora sto appoggiando il piede. Insomma, procediamo. I muscoli mi fanno male. Però tutto bene dai. Sento che dentro di me c'è una gestazione di qualcosa di forte e importante. Ci vuole tempo, purtroppo. Appena mi rimetto ci vediamo e festeggiamo. Io nel mentre lavoro e leggo molto. Ah, sto facendo fisioterapia due volte al giorno. Penso a quando ci rivedremo: un sogno. Sto scrivendo e sto prendendo appunti. Lascio tutto aperto e non fisso nulla. L'unica decisione che prendo è quella di voler andare avanti».
Il cantante ha aggiunto: «Adesso non so quanto ci vorrà per rimettermi in piedi, nessuno lo sa, neanche gli ortopedici. Tra un po' dovrò operarmi per togliermi la placca alla clavicola perché si sta staccando. Ma va bene, andiamo avanti un giorno alla volta. Ho fatto un gran bel casino, chi se lo aspettava».",https://www.leggo.it/spettacoli/musica/jovanotti_come_sta_non_cammina_stampelle_incidente_bici_oggi_16_11_2023-7759983.html
"Totti, peace with Spalletti in the heart of Rome: here's where they met",5,"Luciano Spalletti e Francesco Totti erano in rapporti tesi da diverso tempo, le incomprensioni tra i due risalivano al periodo in cui il capitano giocava ancora. Oggi, 16 novembre, è stata una giornata storica per i due, che si sono finalmente riappacificati. «Dalla parte del cuore si fa l'abbraccio», ha detto il ct della Nazionale azzurra Luciano Spalletti incontrando e abbracciando l'ex capitano della Roma Francesco Totti al Bambin Gesù.L'incontroI due si sono ritrovati per una visita all'ospedale pediatrico di Roma insieme ad una delegazione della Nazionale guidata dal Presidente della Figc, Gabriele Gravina, il capo delegazione della Nazionale, Gianluigi Buffon e il difensore Giovanni Di Lorenzo. Totti è arrivato in scooter mentre gli azzurri con dei van neri. La squadra si prepara anche per l'importante match di venerdì 17 novembre, che si disputerà contro la Macedonia, avversario temuto dopo la sconfitta nelle qualificazioni dei mondiali. ",https://www.leggo.it/sport/calcio/totti_spalletti_pace_roma_16_11_2023-7760264.html
"Gianluca, who died at age 12 of leukemia: six years ago colleagues donated vacation time to his dad to assist him. ""He told me: take me home.""",4,"Aveva solo 12 anni Gianluca Cenedese, stroncato da una leucemia dopo una lunga battaglia, così lunga che il suo corpo alla fine ha ceduto. Accade a Maserada, nel padovano: la sua battaglia andava avanti da anni, tanto che nel 2017 la storia del papà Renzo era stata raccontata dai media locali. Per assistere il figlio infatti l'uomo era stato aiutato dai colleghi, per una gara di solidarietà che aveva lasciato in tanti senza parole. Gianluca morto a 12 anniCome racconta il Corriere del Veneto, Gianluca era un bambino brillante, che per anni ha affrontato per due volte la malattia e le complicazioni che ne seguivano: ieri è morto all'ospedale di Padova, lasciando nella disperazione la sua famiglia, mamma Manuela e papà Renzo, la sorella Giorgia, amici e conoscenti. Sei anni fa i colleghi del padre, che lavora alla tessitura Monti, gli avevano donato le loro ferie per permettergli di assistere per sei mesi il figlio dopo la drammatica notizia del ritorno della leucemia, diagnosticata per la prima volta nel 2013 (quando Gianluca aveva due anni) e che sembrava sconfitta nel 2015. Leucemia linfoblastica acuta recidiva tardiva, si chiamava quel mostro: il bambino lo chiamava 'i vermi', e per motivarsi diceva ai compagni ""Fan***o i vermi"", frase poi fatta stampare su una maglietta dagli stessi compagni. Dopo un trapianto di midollo che sembrava aver avuto succeso, l'anno scorso erano tornati i problemi, fino alla drammatica notizia del decesso di un giorno fa. «Gli chiedevo di essere forte, lui non mollava. La notte scorsa era stata migliore di tante altre. Poi si è svegliato e mi ha detto: papà, voglio andare a casa», il racconto del padre, che da qualche anno, con un'associazione di volontari, fa anche il clown in corsia per stare vicino ai bambini malati. I funerali di Gianluca si terranno sabato a Maserada.",https://www.leggo.it/italia/cronache/gianluca_cenedese_leucemia_bambino_morto_oggi_16_11_2023-7759826.html
"Farmed meat, green light for ban on production and sale in Italy: Coldiretti exults. Brawl in front of Palazzo Chigi",2,"Via libera definitivo - non senza tensione - dell'Aula della Camera al divieto di produrre e vendere in Italia di carne coltivata. L'Italia è il primo Paese in Europa ad introdurre questo divieto. L'Assemblea di Montecitorio ha approvato con 159 sì, 53 no e 34 astenuti il disegno di legge presentato dal ministro dell'Agricoltura Francesco Lollobrigida che proibisce la produzione e di immissione sul mercato di alimenti e mangimi costituiti, isolati o prodotti a partire da colture cellulari o di tessuti derivanti da animali vertebrati nonché di divieto della denominazione di carne per prodotti trasformati contenenti proteine vegetali. Applausi e grida di gioia hanno accompagnato il via libera. A festeggiare il disco verde è Coldiretti, raccolta in un sit in organizzato sotto il porticato della Galleria Colonna, a due passi da Palazzo Chigi.Riccardo Magi e Benedetto Della Vedova spintonatiIl segretario di +Europa Riccardo Magi e Benedetto Della Vedova sono stati spintonati e insultati davanti a palazzo Chigi dal presidente nazionale della Coldiretti Ettore Prandini. I due esponenti di + Europa stavamo esponendo un cartello con su scritto «Coltivate ignoranza, il divieto alla carne coltivata è antiscientifico e anti italiano» proprio a pochi metri dalla manifestazione della Coldiretti contro il cibo artificiale. «Sono stato aggredito fisicamente dal presidente della Coldiretti Ettore Prandini, che mi ha detto che sono un delinquente», ha detto Della Vedova, sottolineando che «Prandini non può restare presidente di una grande organizzazione con una grande tradizione dopo il modo in cui si è comportato».La reazione di Alleanza Verdi e Sinistra«È intollerabile il comportamento del presidente di Coldiretti Ettore Prandini che davanti a Palazzo Chigi ha aggredito i nostri due colleghi Riccardo Magi e Benedetto Della Vedova a cui va la nostra solidarietà. Si tratta infatti di un attacco insopportabile all'esercizio elementare della democrazia da parte, per altro, di parlamentari eletti, che hanno il diritto-dovere di esprimere liberamente il proprio giudizio in aula e fuori». Lo dice la presidente di Alleanza Verdi e Sinistra alla Camera Luana Zanella. «Se si sono verificati episodi di violenza verbale o fisica fuori di questa Aula verso esponenti delle Istituzioni, ad essi va solidarietà: come va a quel sindacato che in quest'Aula è stato oggetto di una valutazione che non fa onore a chi la fa, e cioè di lobby. Un sindacato rappresenta i lavoratori». Lo ha detto nell'Aula della Camera il capogruppo di Fdi Tommaso Foti in dichiarazione di voto finale sul ddl che vieta la carne coltivata.",https://www.leggo.it/politica/news/carne_coltivata_divieto_italia_cosa_succede_coldiretti_rissa_oggi_16_11_2023-7760086.html
Dad discovers baby's sex and bursts into tears: 'I'm afraid history will repeat itself',3,"Per una coppia che desidera avere figli e allargare, quindi, la famiglia, la notizia di un bebè in arrivo è bellissima e sconvolgente allo stesso tempo. Dovrebbe, tuttavia, essere scioccante in senso positivo e non negativamente come è, invece, successo al futuro papà che si è lasciato andare a lungo sfogo su Reddit. Il ragazzo, infatti, ha cominciato ad agitarsi quando ha scoperto che avrebbe avuto un figlio maschio e il motivo è presto detto. La storiaUn futuro papà si è lasciato andare a un lungo sfogo su Reddit, dove ha raccontato: «Io e mia moglie abbiamo organizzato un gender reveal con amici e familiari per scoprire se avremmo avuto un bambino o una bambina. Abbiamo saputo che aspettiamo un maschietto. Non l'ho detto a mia moglie, ma speravo davvero in una figlia femmina, invece che in un figlio. Quando è stato rivelato che avremmo avuto un maschio, sono rimasto davvero sconvolto. Non volevo rovinare la giornata a tutti, quindi, ho cercato di comportarmi normalmente e festeggiare con mia moglie e la famiglia. Poi, alla fine della festa, sono scoppiato in lacrime, non riuscivo a fermarmi. Volevo davvero una figlia femmina, perché mio padre era davvero cattivo con me e i suoi comportamenti mi hanno davvero traumatizzato. Ho paura che, un giorno, potrei fare lo stesso con mio figlio, ho paura che la storia si ripeta. Non voglio rovinarlo come mio padre ha fatto con me. Ho avuto paura di diventare come lui sin da prima di incontrare mia moglie e il motivo principale per cui, inizialmente, non volevo figli era il timore che li avrei trattati come lui trattava me. Mia moglie non sa nulla di questi pensieri ed è arrabbiata con me perché pensa che il mio pianto sia dovuto alla sua gravidanza». ",https://www.leggo.it/esteri/news/papa_scopre_sesso_bambino_lacrime_reddit_oggi_16_11_2023-7759979.html
"Stray dog gets lost and ends up on runway, plane forced to turn back",3,"A volte, capita che animali randagi o selvatici perdano l'orientamento e finiscano in posti in cui non dovrebbero nemmeno entrare, come le piste di atterraggio o decollo negli aeroporti. Un cane che vagava per le strade vicine all'aeroporto di Dabolim a Goa, India, si è perso e, spaventato, si è piazzato in mezzo alla pista, constringendo il pilota del volo Vistara UK881 a tornare indietro. La vicendaLa vicenda è stata riportata da PTI che ha raccontato ciò che è successo al termine del volo Vistara UK881. L'aereo era partito da Bangalore, India e avrebbe dovuto effettuare l'atterraggio all'aeroporto di Dabolim a Goa. Il pilota, però, è stato avvisato dal controllore del traffico aereo della presenza in mezzo alla pista di un cane randagio che non accennava a spostarsi e, tantomeno, a farsi prendere. Dopo diverso tempo in aria, il pilota non è più riuscito a temporeggiare e il direttore dell'aeroporto di Goa, SVT Dhanamjaya Rao ha detto ai media locali: «Il pilota ha preferito tornare a Bangalore e ripetere il volo e l'atterraggio una volta che la pista fosse stata messa in sicurezza». Scimmie assasine, bambino di 10 anni ucciso per strada. È il terzo attacco in una settimanaLe dichiarazioni del direttore dell'aeroportoDhanamjaya Rao, direttore dell'aeroporto di Goa, sempre ai media locali ha detto: «È già successo che animali invadano la pista ma, solitamente, se ne vanno in fretta.",https://www.leggo.it/animali/cane_randagio_pista_aeroporto-7760176.html
"Dogs, here are the most popular names: 'Sea Out' effect, Tyson wins in Milan",3,"Secondo il “Top Pet Names” di Rover.com, a livello nazionale il nome più comune per i cani è Luna. Il report ha analizzato tutti i fattori che influenzano i padroni nella scelta del nome per gli amici a quattro zampe. Milano, 'effetto Mare Fuori''Mare Fuori', la serie tv sul carcare minorile di Napoli, spopola a Milano, dove il nome più scelto è 'Tyson', come l’American Staffordshire terrier di Pino della stessa fiction.  Sotto la madonnina, oltre a Tyson, i nomi più gettonati sono Kelly (2°), Roger (3°), Chicca (4°) e Iron (5°). Le altre cittàPer Roma invece troviamo Gina (1°), Peter (2°), Dora (3°), Muffin (4°) e Roger (5°). Se ci spostiamo a Firenze, le scelte variano da Bianca, Charlie, Kira, Brugola e Nala, mentre a Venezia troviamo molti cani chiamati Luna, Gilda, Mia, Sky e Jack. A Napoli, i proprietari tendono a scegliere per i propri cuccioli nomi come Masha, Teddy, Blu, Eric o Loki, mentre a Torino i più comuni sono Diana, Hope, Ice, Neve e Athena. Scelti da tv e vip 
Tra i padroni c'è anche chi scegli in base ai personaggi tv o ai vip. Tra gli amanti dei programmi e delle serie tv, infatti, il nome più comune è Olivia, come il personaggio interpretato da Sydney Sweeney nella prima stagione di 'The White Lotus', seguito da Leone, il primogenito in casa Ferragnez, al terzo posto Roy, al quarto Logan e al quinto Tom, tutti nomi ispirati ai personaggi della serie 'Succession'.

Amanti dell'arte e del cibo 
Anche l'arte gioca un ruolo importante nelle scelte che spaziano da Giotto a Giorgio, come il famoso artista esponente della pittura metafisica Giorgio De Chirico, da Lucio, come Fontana, fino ad arrivare a Leonardo.",https://www.leggo.it/animali/nomi_cani_piu_scelti_milano_mare_fuori_16_11_2023-7760295.html
"""Job interviews, if they ask you these three things you must lie"": expert's advice",2,"Una delle fasi più stressanti del percorso lavorativo si trova proprio all'inizio: il colloquio. In effetti, in tanti lamentano lo stress e la pressione nel dover dimostrare a quello che potrebbe essere il tuo futuro capo quanto vali in poco tempo e in un contesto che non ha molto a che fare con le mansioni di cui ci si occuperà in caso di assunzione.Ci sono vari tipi di colloqui, anche a seconda dell'azienda e del ruolo che si vorrebbe ricoprire, ma nella maggior parte dei casi alcune domande sono pressoché inevitabili e scatenano l'indecisione: rispondere con onestà o ""decorare la verità"" e piegarla in modo da ottenere la posizione che si desidera?Bonnie Dilber, esperta reclutatrice, consiglia la menzogna in questi tre specifici casi. Vediamo quali sono. «Tre cose su cui è necessario mentire in ogni colloquio»
Il video in cui Bonnie spiega «le tre cose su cui mentire in ogni colloquio» ha superato il milione di visualizzazioni e nei commenti gli utenti si dividono riguardo le loro esperienze in proposito: alcuni si meravigliano che ci sia chi, in quei casi, decide di essere sincero; altri, invece, affermano di preferire essere onesti anche a costo di non ottenere il lavoro.

Al di là di ciò che si preferisce fare con queste informazioni, tuttavia, è utile comprendere il funzionamento del colloquio e ciò che le aziende, giusto o sbagliato che sia, si aspettano dal lavoratore. Altre persone che affermano di occuparsi di colloqui hanno confermato la validità dei consigli di Bonnie, che hanno poi scatenato una discussione su quanto sia vergognoso doversi nascondere dietro delle bugie per poter essere considerati una risorsa.",https://www.leggo.it/schede/lavoro_colloqui_mentire_consigli_esperta_oggi_16_11_2023-tre_cose_su_cui_e_necessario_mentire_in_ogni_colloquio-2-7759639.html
Greta Rossetti and the love dedication that is not for Mirko Brunetti (liked by Beatrice Luzzi),5,"Greta Rossetti è pronta ad assistere a una nuova puntata del Grande Fratello e a seguire le avventure dei gieffini, in particolar modo del suo fidanzato Mirko Brunetti. Nelle scorse settimane, l'influencer si era espressa in merito alla crisi che stava vivendo con il compagno: i due non si sentivano da diverso tempo e continuavano a lanciarsi frecciatine social. Poi, finalmente, il confronto nella casa del GF e la pace tanto sognata dai fan. Nelle sue ultime storie, Greta ha dedicato una canzone d'amore a qualcun altro che non è Mirko ma il suo cagnolino. Intanto, Beatrice Luzzi non è indifferente alla bellezza del 26enne. 

La storia Instagram di Greta Rossetti
Greta Rossetti è molto attiva sul proprio profilo Instagram e, ogni giorno, ha un bel da fare a rispondere ai messaggi dei follower e a smentire categoricamente le voci che la vorrebbero nella casa del Grande Fratello. I più maliziosi pensano che l'influencer sarà molto impegnata anche nelle prossime settimane quando dovrà osservare il suo fidanzato Mirko Brunetti rapportarsi con l'ex compagna storica, Perla Vatiero che sarà una nuova concorrente. Intanto, Greta vuole godersi la tranquillità e, dopo la pace con Mirko, si sta dedicando all'altro amore della sua vita: il suo cagnolino al quale ha dedicato la canzone ""Niente Più"" di Claudio Baglioni. 

Mirko Brunetti: «Ho delle brutte sensazioni su Greta». La confessione ad Angelica Baraldi, lei lo mette in guardia",https://www.leggo.it/gossip/grande_fratello/greta_rossetti_dedica_amore_cane_oggi_16_11_2023-7760276.html
