translated_title,score,text,source
Shooting stars light up the November sky: the Leonid meteor shower is coming. How and when to see them,5,"Le Leonidi, uno degli sciami meteorici più rapidi e spettacolari, illumineranno il cielo nella notte tra venerdì 17 e sabato 18 novembre. Queste meteore - conosciute comunemente come stelle cadenti - possono raggiungere la straordinaria velocità di 72 chilometri al secondo, che corrispondono a circa 260.000 chilometri orari. Lo sciame meteorico delle Leonidi porterà lunghe scie luminose, non di rado accompagnate da boati. Di seguito, tutto quello che c'è da sapere per non perdersi il fenomeno previsto per domani, 17 novembre. Cosa sono e da dove arrivano le Leonidi
Le Leonidi prendono il proprio nome dal radiante in cui si trovano, ovvero l'area del cielo da cui sembrano originare le scie luminose, che nel caso delle Leonidi è inquadrato nella costellazione del Leone. Le meteore sono prodotte da detriti e polveri lasciate dalla cometa 55P/Tempel-Tuttle, che entra nella nostra orbita ogni 33 anni. A provocare il fenomeno dello sciame meteorico è un'interazione tra la nube della cometa e il nostro pianeta Terra: nel momento in cui la Terra intercetta la nube, solitamente proprio intorno a metà novembre, i frammenti entrano nell'atmosfera terrestre bruciando per ablazione e creando così delle spettacolari fiammate nel cielo. La velocità e il colore di queste fiammate che vediamo possono variare in base a diversi parametri chimici e fisici quali l'angolo di entrata, la composizione chimica e la massa dei frammenti. Quelli più grandi, tipici delle Leonidi, possono produrre dei veri propri bolidi accompagnati da un boato.La cometa Temple-Tuttle

L'ultima volta che la cometa 55P/Tempel-Tuttle è venuta a trovarci era il 1998. L'Unione Astrofili Italiani (UAI) nella rubrica Il Cielo del Mese, spiega: «Quest'anno non possiamo che aspettarci un'apparizione blanda comunque senza sorprese. Ciò che osserveremo sarà la componente annuale, formata da meteore per lo più di bassa luminosità, che in genere si mostra con un aumento di frequenza per circa una giornata» Tuttavia, le condizioni di avvistamento saranno buone: la Luna, infatti, con la sua luminositò non arrecherà disturbo nella seconda parte della notte tra il 17 e il 18.",https://www.leggo.it/schede/leonidi_stelle_cadenti_novembre_quando_dove_vederle_sciame_meteorico_oggi_16_11_2023-7760212.html
"Police ""hire"" Paulinho cat: distributes affection and lightens routine",5,"Il primo distretto di polizia civile di Bagé, in Brasile, offre a coloro che necessitano assistenza un'accoglienza fuori dal comune: la presenza di Paulinho, il gatto poliziotto. Il tenero felino si era recato al distretto in cerca di cibo e cure e grazie al suo caratetre affabile e curioso è diventato parte integrante della squadra. Al gattino è stato conferito il titolo di ""delegato"", e indossa un giubottino con lo stemma della polizia, e grazie alla sua presenza, la frenesia e la frustrazione che spesso si accusa sul posto di lavoro, è diminuita esponenialmente: Paulinho riesce a strappare un sorriso a tutti, racconta Rbs Tv.Il delegato Guilherme Fagundes, ""collega"" del micio, scherza spesso sul suo ruolo, e afferma che in caso di assenza Paulinho si siede spontaneamente alla sua scrvania per sostituirlo. Sebbene oggi il gattino si sia adattato alla vita in distretto, i primi giorni furono piuttosto turbolenti, il micio ha infatti fatto la pipì sullo zaino di un poliziotto, ma grazie al suo cambio di atteggiamento è stato riabilitato e accolto a lavoro. ",https://www.leggo.it/esteri/news/gatto_poliziotto_brasile_16_11_2023-7760220.html
"Antonella Clerici, swipe at Mediaset live: ""We are always there...""",4,"Nelle ultime ore i palinsesti televisivi Mediaset hanno visto dei cambiamenti improvvisi complice il fenomeno Jannik Sinner e la sua vittoria show contro Djokovic, che ha portato grandi ascolti a Rai 2, proprio per questo motivo sono stati spostati alcuni debutti: la prima puntata di Io Canto Generation e l'inizio della seconda stagione di Un Professore. Antonella Clerici, approfittando di questa situazione, ha voluto dire la sua, lasciandosi ""sfuggire"" una battuta in diretta riferita a Mediaset. Durante la puntata di oggi 16 novembre di ""è sempre mezzogiorno"", Antonella Clerici ha voluto ricordare al pubblico l'appuntamento con The Voice Kids, il 24 novembre, infatti, la conduttrice tornerà in prima serata Rai 1 con il talent dei bambini. Frecciatina«Venerdì 24 novembre,segnatevelo. Noi siamo sempre lo stesso giorno, venerdì cominciamo con The Voice Kids», ha affermato in tono scherzoso. ",https://www.leggo.it/spettacoli/televisione/antonella_clerici_mediaset_16_11_2023-7760051.html
"Francesco Chiofalo and the car accident: ""I feel bad for Drusilla, I put her in danger.""",2,"Sono stati momenti di grande tensione e paura per Drusilla Gucci e il suo fidanzato Francesco Chiofalo. La coppia nei giorni scorsi è rimasta vittima di un incidente stradale nella notte: i due si trovavano sull'autostrada che collega Firenze a Roma. Drusilla e Francesco stavano raggiungendo la Capitale per motivi di lavoro e avevano deciso di viaggiare di notte per non trovare traffico. La BMW M4 sulla quale viaggiavano è finita contro un cordolo stradale. Tuttavia, nelle ultime ore, il personal trainer si è detto amareggiato per quanto successo e ha commentato nuovamente l'episodio nelle sue Instagram stories. Ma andiamo a vedere cosa ha detto nel dettaglio.Francesco Chiofalo su Instagram«Purtroppo mi sento molto in colpa nei confronti di Drusilla - ha sottolineato Francesco Chiofalo nelle sue Instagram stories -. Aver fatto questo incidente stradale con lei in macchina e aver rischiato di metterla in pericolo mi ha creato un forte senso di colpa, nonostante lei mi abbia detto più volte che sono cose che capitano e che non è arrabbiata con me. Ma io purtroppo non riesco a non sentirmi fortemente in colpa nei suoi confronti. La sera dell'incidente era notte e pioveva a dirotto l'ho vista spaventata e sotto shock e questa cosa mi ha veramente turbato».
Il personal trainer ha aggiunto: «Avrei preferito un milione di volte fare l'incidente da solo senza di lei. Mi sento mortificato e fortemente amareggiato».",https://www.leggo.it/gossip/news/francesco_chiofalo_incidente_stradale_drusilla-7760025.html
"Biden: ""Xi is a dictator."" Beijing responds, ""Irresponsible political manipulation."" Tensions after the meeting",2,"Il confronto è stato tutto sommato positivo, eppure anche stavolta non mancano tensioni sul fronte Usa-Cina. Joe Biden, infatti, ha definito Xi Jinping un «dittatore» al termine del loro confronto in California. Il presidente statunitense ha spiegato: «È un dittatore nel senso che governa un Paese comunista, basato su una forma di governo totalmente diversa dalla nostra». Ma quella di «dittatore» è una definizione che non è affatto piaciuta alla Cina, che l'ha contestata bollandola come «estremamente sbagliata»Biden-Xi, l'ora del dialogo: «Nel mondo posto per tutti». La promessa: «Non ci volteremo le spalle»La portavoce del ministero degli Esteri, Mao Ning, ha osservato che «questo tipo di discorso è estremamente sbagliato ed è una manipolazione politica irresponsabile. La Cina si oppone con fermezza». Sul punto, «devo sottolineare che ci sono sempre alcune persone con secondi fini che tentano di seminare discordia e rovinare le relazioni tra Cina e Usa, e anche questo non avrà successo», ha aggiunto Mao.Alla richiesta di chiarimenti sul riferimento alle persone che «tentano di seminare discordia e rovinare le relazioni tra Cina e Usa», Mao ha replicato: «Penso che chiunque stia cercando di indebolire e seminare discordia tra Cina e Stati Uniti lo sappia». Usa-Cina, come è andato l'incontro fra Biden e Xi
I due presidenti hanno avuto il loro primo faccia a faccia da novembre 2022, tra aspre e crescenti tensioni, concordando sulla necessità di ripristinare le comunicazioni di alto livello, incluse quelle militari congelate da circa 10 mesi a seguito della vicenda del pallone-spia aerostatico cinese abbattuto dai Usa dopo essere stato intercettato nello spazio aereo americano.",https://www.leggo.it/esteri/news/biden_xi_incontro_dittatore_usa_cina_oggi_16_11_2023-7759723.html
"Boat sinks in the Bahamas with 100 tourists on board: one woman dead, two injured. The video is frightening",1,"Un catamarano con a bordo più di 100 turisti è affondato nelle Bahamas durante il tragitto per raggiungere la famosa isola turistica Blue Lagoon. Una donna ha perso la vita e altre due persone sono state portate in ospedale per le ferite riportate, ma le indagini sono ancora in corso e non è chiaro quale sia il loro stato di salute. Camion tampona un pulmino di turisti, un morto e 8 feriti: 4 sono graviBimbo di 2 anni dimenticato sul bus, muore dopo otto ore: «L'autista non lo ha visto». Il dolore della mammaCos'è successo: il video della tragediaIl sovrintendente capo Chrislyn Skippings ha dichiarato che la donna di 74 anni che ha perso la vita proveniva dal Colorado, negli Stati Uniti, ed era lì in vacanza con la sua famiglia. Il resto dei passeggeri e dei membri dell'equipaggio sono stati recuperati. Tra questi, ci sarebbero due feriti, secondo quanto riportato dalla polizia e da ABC 7.Becky e Matt Savage, una coppia di Chicago, si trovavano sulla barca insieme ai due figli quando, secondo le loro dichiarazioni, sono stati colpiti da due onde particolarmente imponenti: «La prima, molto alta, ci ha investiti e ho visto che ne arrivava anche una seconda, quindi ci siamo spostati per non essere travolti».Becky racconta che i passeggeri hanno iniziato a gridare per avere i giubbotti di salvataggio ed è scoppiato il caos: «I giubbotti erano sul ponte superiore, in un cesto, e sono tutti corsi verso quel punto per prenderli».",https://www.leggo.it/esteri/news/barca_affonda_bahamas_turisti_morto_feriti_oggi_16_11_2023-7759611.html
"Culture of Spirit Festival arrives in Rome at Villa Giulia museum gardens: music, dance, theater and meditation",4,"Dopo 15 anni di successi in Val Borbera, in varie città Europee e negli Stati Uniti, il Festival Cultura dello Spirito dedicato a musica, danza, teatro e meditazione sbarca a Roma. Con l’occasione straordinaria dei cento anni di Shri Mataji Nirmala Devi, Sahaja Yoga Italia aps e il Theatre of Eternal Values aps, con il patrocinio del II Municipio di Roma e in collaborazione con il Museo Nazionale Etrusco di Villa Giulia, hanno deciso di organizzare il Festival nella Capitale, proprio nella meravigliosa cornice del museo.Varie conferenze dedicate a: L’archetipo della Grande Madre nella storia, all’espressione del pensiero filosofico in relazione con le neuroscienze e la ricerca di “una felicità possibile”, alle connessioni tra la tradizione spirituale etrusca e le sue evoluzioni nelle differenti culture; si alterneranno a brillanti esibizioni di maestri di musica, danza, teatro e poesia occidentale e orientale.Un momento speciale la presentazione del libro “La via spontanea alla Realizzazione del Sé” e alla vita di Shri Mataji Nirmala Devi. Una serie di artisti (tra gli altri Carlo Gizzi, Leo Vertunni, Manish Madankar, Valeria Vespaziani, Chiara di Benedetto, Ljiljana Liskovic, Alessandro Martin) porranno in dialogo le tradizioni artistiche di Oriente e Occidente, mentre studiosi di cultura occidentale e orientale (Andrea Antoniani, Duilio Cartocci, Adriano Ercolani) si alterneranno per mettere in luce l’evoluzione spirituale nella storia fino ai giorni nostri e la possibilità di raggiungere nuovi livelli di consapevolezza e conoscenza di sé per vivere un reale stato interiore di pace ed integrazione.",https://www.leggo.it/schede/roma_festival_cultura_dello_spirito_oggi_26_10_2023-7717284.html
"Book festival, Piedmont city prepares for journey into the Middle Ages",4,"Prende il via venerdì 20 ottobre la terza edizione della ‘Festa del libro medievale e antico di Saluzzo’, che per tre giorni animerà la cittadina piemontese. A ispirare la rassegna 2023, dedicata al tema del viaggio nel Medioevo, sono alcuni versi di Ludovico Ariosto nell’Orlando furioso: Chi va lontan da la sua patria, vede / cose, da quel che già credea, lontane; / che narrandole poi, non se gli crede. Il programma
 
Sarà questo, dunque, il file rouge della manifestazione libraria e fieristica nata nel 2021 i cui strumenti di approfondimento sono romanzi, saggi, lezioni magistrali, spettacoli, performance, concerti, momenti conviviali, azioni pittoriche collettive. Ma anche gare di caccia al tesoro, giochi a tema, laboratori e proiezioni cinematografiche. Un programma che viene affiancato dalle proposte degli editori e delle librerie antiquarie provenienti da tutta Italia.",https://www.leggo.it/cultura/news/festa_del_libro_medievale_saluzzo_oggi_18_10_2023-7700438.html
"Pompeii destruction, artificial intelligence deciphers a 2,000-year-old parchment: what was written on it",4,"L'intelligenza artificiale ha decifrato una pergamena rimasta sepolta nell'eruzione del Vesuvio nel 79 d.C. che ha colpito le città di Pompei ed Ercolano, distruggendo una ricca collezione di 1.800 pergamene trovate ad Ercolano nel 1752, l’unica biblioteca intatta mai conosciuta della storia antica. Ogni rotolo è stato estremamente danneggiato, pertanto è piuttosto difficile da aprire, figuriamoci da leggere.Cimici dei letti anche in Italia? «Situazione nella norma, almeno per ora». Come evitare il rischio di diffusionePrima parolaNegli anni sono stati diversi i tentativi falliti di leggeri i papiri ritrovati in quella che doveva essere una villa lussuosa di proprietà del suocero di Giulio Cesare, ma oggi l’IA, grazie a un algoritmo appositamente addestrato e assieme alla tomografia a raggi X ha permesso di far emergere da uno dei papiri una prima parola: porpora. Un tesoro storico e culturale di inestimabile valore, con opere di filosofia, ma anche cronache del tempo e informazioni di vita quotidiana. Sfida internazionale
Si chiama “Vesuvius Challenge”, la sfida internazionale tra informatici lanciata a marzo scorso dall’Università del Kentucky, che ha permesso di identificare alcune lettere in alfabeto greco. I ricercatori e gli esperti di intelligenza artificiale potranno guadagnare 700.000 dollari se saranno la prima squadra a leggere almeno quattro passaggi separati nei rotoli entro il 31 dicembre.",https://www.leggo.it/italia/cronache/eruzione_vesuvio_pompei_pergamena_oggi_16_10_2023-7696464.html
"Plots of light, at the Botanical Garden music and games of ""light art""",3,"È la passeggiata più emozionante dell’anno. Un percorso scintillante di arte luminosa che accenderà di magia l’Orto Botanico a Roma dal 16 novembre al 7 gennaio (dal 18 e per lo stesso periodo anche i Giardini della Villa Reale di Monza). È Trame di luce, la mostra immersiva multisensoriale di light art di proprietà di IMG e prodotta e curata in Italia da Be.it Events. Ad andare in scena “en plein air” sono le creazioni di artisti italiani e stranieri, musicate dal compositore Alberto Bof: tappa dopo tappa, si attraversano un bosco delle lucciole, un albero adornato di insoliti cappelli dei folletti, un tunnel di proiezioni laser, un prato di leggiadri origami o di leggendari kappa, le creature mitologiche del Sol Levante. Ma anche una grande volta composta da centinaia di segmenti illuminati, uno spazio di galassie con degli anelli sospesi danzanti e una scalinata animata da luci e note sincronizzate. Oltre agli “spot” per la foto ricordo, non mancherà l’area ristoro del Villaggio del Gusto. L’accesso è dai giardini dell’Accademia dei Lincei. Si entra solo con biglietto digitale, acquistabile su",https://www.leggo.it/italia/roma/trame_di_luce_all_orto_botanico_musica_e_giochi_di_light_art-7758038.html
Svelato il tema del Met Gala 2024: «Sleeping Beauties: Reawakening Fashion»,3,"Questa mattina è stato finalmente svelato il tema del Met Gala, l'evento moda più importante dell'anno che si tiene all'interno del Costume Institute del Metropolitan Museum di New York. «Belle addormentate-il risveglio della moda», sarà il tema predominante del gala, che sarà accompagnato da una mostra strutturata intorno a 50 pezzi troppo fragili per essere indossati,da cui il nome le ""belle addormentate"", insieme a 250 pezzi d'archivio di designer iconici quali Elsa Schiaparelli, Yves Saint Laurent, Christian Dior esposti in gallerie organizzate secondo i tre temi principali della natura: Terra, Mare e Cielo. «La moda è una delle forme artistiche più emozionanti a causa della sua connessione con il corpo. È intriso di memoria ed emozioni e ci relazioniamo ad esso principalmente attraverso i nostri sensi. Una cosa che spero che questa sfilata stimoli è l’apprezzamento sensoriale della moda», ha dichiarato il curatore del Costume Institute Andrew Bolton a Vogue questa mattina. Pezzi d' archivio esposti insieme a lavori di moda contemporanea attraverso tecniche sensoriali che si serviranno dell'intelligenza artificiale storia e modernità, il risveglio di una bellezza dormiente che lascia spazio al progresso senza perdere completamente la propria classicità. 
Il Met Gala si terrà il prossimo 6 maggio a New York, ancora non sappiamo chi sarà la madrina del Met, ma per gli amanti della moda sta per iniziare il periodo migliore dell' anno dove social e riviste si riempiono di fotografia, arte e ispirazione per dare il via ai preparativi del gala. ",https://www.leggo.it/moda/met_gala_2024_tema_quale_8_11_2023-7743488.html
"Louise Glück, dead American poet laureate of Nobel Prize for Literature: she was 80 years old",2,"Folgorata dalla poesia fin da bambina, quando si inventò un concorso per premiare la più bella poesia del mondo, premio che poi nel 2020 i giurati del Nobel attribuirono a lei: Louise Gluck, l'americana insignita tre anni fa del massimo riconoscimento mondiale per la letteratura dopo aver collezionato per il suo lavoro un Pulizter e un National Book Award, è morta a 80 anni di cancro nella sua casa di Cambridge in Massachusetts.Chi era Louise GluckHa dato l'annuncio Jonathan Galassi, che aveva curato negli Usa la pubblicazione delle sue opere per la casa editrice Farrar, Straus e Giroux. Gluck è stata la sedicesima donna a vincere il Nobel per la letteratura: prima di lei l'ultimo americano premiato era stato Bob Dylan. La prima cosa che aveva pensato, una volta ricevuta la telefonata del premio da Stoccolma - con relativo assegno da dieci milioni di corone svedesi, l'equivalente di poco più di un milione di dollari, era stata: «Potrò comprarmi una casa in Vermont». L'altro pensiero era stato «come preservare la vita quotidiana delle persone che amo».E sempre a caldo la poetessa, che nelle sue creazioni letterarie aveva esplorato i temi del trauma e della perdita, della famiglia e della solitudine, aveva pensato: «Non avrò più amici. Quasi tutti sono scrittori». Poi, alla richiesta di cosa suggerire di leggere a chi non era familiare con la sua opera, aveva consigliato «di non partire dal suo primo libro» (Firstborn del 1968) e partire magari con Averno, la raccolta basata sul rapporto madre-figlia con il mito di Demetra e Persefone di sfondo pubblicata nel 2006 negli Usa e in Italia nel 2019 dalla casa editrice e libreria di Napoli Dante & Descartes, o con Faithful and Virtuous Night del 2014.Dopo il Nobel, i suoi 12 volumi di poesie sono stati acquistati dal Saggiatore. Gluck, che l'anno scorso era stata insignita in Italia del premio Lerici Pea, era nata a New York. Il Vermont aveva preso però un posto speciale nel suo cuore: fu lì, dopo aver cominciato a insegnare al Goddard College, che Louise superò un lungo «blocco dello scrittore» e che produsse la sua seconda raccolta di poesie, The House on Marshland, pubblicata nel 1975 e applaudita dalla critica.",https://www.leggo.it/cultura/news/louise_gluck_morta_nobel_chi_era_poesie-7691071.html
"Nobel Peace Prize 2023, Narges Mohammadi wins: at the forefront of the fight against women's oppression in Iran",5,"Il Comitato norvegese per il Nobel ha deciso di assegnare il Premio Nobel per la pace 2023 a Narges Mohammadi per la sua lotta contro l'oppressione delle donne in Iran e per la promozione dei diritti umani e della libertà per tutti. Mohammadi ha pagato a caro prezzo le sue battaglie. Il regime iraniano l'ha arrestata 13 volte, condannata cinque volte e condannata a un totale di 31 anni di carcere e 154 frustate. Mohammadi è ancora in prigione. Mohammadi in carcereIl comitato per il Nobel, assegnando il premio per la pace, ha affermato che «la coraggiosa lotta di Narges Mohammadi ha comportato enormi costi personali. Il regime iraniano l'ha arrestata 13 volte, condannata cinque volte e condannata a un totale di 31 anni di carcere e 154 frustate». Mohammadi è ancora detenute nel famigerato carcere di Evin e il comitato ha espresso l'auspicio che l'Iran rilasci l'attivista.",https://www.leggo.it/cultura/news/nobel_pace_narges_mohammadi_chi_e_iran_donne_oggi_6_10_2023-7675837.html
"Nobel Prize in Literature to Jon Fosse, who is the Norwegian writer and playwright who gives voice to the unspeakable: ""Me surprised, but not too surprised""",5,"Il Premio Nobel per la Letteratura 2023 va a Jon Fosse, scrittore e  drammaturgo norvegese. Fosse è considerato uno dei maestri della letteratura scandinava, in particolare autore emblematico della scena teatrale contemporanea. L'autore norvegese è stato scelto dal Comitato «per le sue opere teatrali e la prosa, innovative, che danno voce all'indicibile». «La sua immensa opera scritta in norvegese Nynorsk e che abbraccia una varietà di generi è costituita da una vasta gamma di opere teatrali, romanzi, raccolte di poesie, saggi, libri per bambini e traduzioni. Sebbene oggi sia uno dei drammaturghi più rappresentati al mondo, è diventato sempre più riconosciuto anche per la sua prosa», afferma il Comitato sul sito. Fosse è rimasto «sorpreso ma non troppo» all'annuncio del Premio Nobel. Lo ha detto all'emittente pubblica norvegese Nrk, come riferisce la France Presse. «Negli ultimi dieci anni mi sono preparato con cautela al fatto che ciò potesse accadere. Ma credetemi, non mi aspettavo di ricevere il premio oggi, anche se avevo una chance», ha spiegato Fosse che ha ricevuto la telefonata dell'Accademia svedese mentre stava guidando nei pressi di Bergen, sulla costa occidentale della Norvegia. Chi è
Nato il 29 settembre 1959 a Haugesund, un piccolo villaggio sulla costa occidentale norvegese, crescendo a Strandebarm, sullo spettacolare fiordo di Hardanger. Si è laureato all'Università di Bergen in letteratura comparata e da allora ha iniziato a dedicarsi a tempo pieno alla scrittura, insegnando a lungo all'Accademia di scrittura di Hordaland. Oggi vive nella residenza onoraria di Grotten, a Oslo, concessagli dal re di Norvegia per i suoi meriti letterari che lo hanno reso famoso a livello internazionale. Fosse è uno scrittore incredibilmente prolifico e un intellettuale poliedrico, tra le voci più significative della drammaturgia contemporanea, tanto da guadagnarsi il soprannome di «Samuel Beckett del XXI secolo». Ha esordito nella scrittura nel 1983 con il romanzo «Raudt, svart» («Rosso, nero»), sperimentando successivamente generi e stili eterogenei, quali la narrativa breve, la poesia, la saggistica e la letteratura per l'infanzia. Le sue opere sono state tradotte in oltre 40 lingue, compreso l'italiano.",https://www.leggo.it/cultura/news/nobel_letteratura_jon_fosse_chi_e_2023-7673829.html
